{
  "schema": "urn:marginbench:experiment-ledger:v1",
  "benchmarkVersion": "0.1.0",
  "recordedAt": "2026-08-18T15:03:29Z",
  "provider": "Prime Intellect",
  "model": "qwen/qwen3.7-flash",
  "harness": "verifiers-v1/null-with-one-margin-tool",
  "taskSet": "public-development-v1/repetition-0",
  "wallet": {
    "openingBalanceUSD": 199.9861,
    "closingBalanceUSD": 199.9425,
    "observedDebitUSD": 0.0436,
    "traceReportedUSD": 0.0417,
    "unreconciledUSD": 0.0019
  },
  "totals": {
    "attempts": 21,
    "completed": 18,
    "infrastructureErrors": 3,
    "modelCalls": 228,
    "promptTokens": 907942,
    "completionTokens": 70959,
    "cachedInputTokens": 449664,
    "reasoningTokens": 50068
  },
  "attempts": [
    {
      "id": "gate1-baseline",
      "gate": 1,
      "scenario": "human_agent_relay",
      "candidate": "baseline",
      "status": "completed",
      "recordedScore": 25.0,
      "exactDurableOutcome": false,
      "safetyPassed": false,
      "durationMs": 29690,
      "modelCalls": 10,
      "invalidCommandCount": 1,
      "traceReportedCostUSD": 0.0017,
      "walletDebitUSD": null,
      "artifact": "EXPERIMENTS.json",
      "findingCodes": ["GUESSED_READ_COMMAND", "NEW_THREAD_INSTEAD_OF_REPLY", "THREAD_NOT_RESOLVED"]
    },
    {
      "id": "gate1-read-alias-v1",
      "gate": 1,
      "scenario": "human_agent_relay",
      "candidate": "read-alias-and-reply-help-v1",
      "status": "completed",
      "recordedScore": 25.0,
      "exactDurableOutcome": false,
      "safetyPassed": false,
      "durationMs": 28598,
      "modelCalls": 9,
      "invalidCommandCount": 1,
      "traceReportedCostUSD": 0.0013,
      "walletDebitUSD": null,
      "artifact": "EXPERIMENTS.json",
      "findingCodes": ["REPLY_FIXED", "GUESSED_CAT_COMMAND", "THREAD_NOT_RESOLVED"]
    },
    {
      "id": "gate1-candidate2-rate-limit",
      "gate": 1,
      "scenario": "human_agent_relay",
      "candidate": "read-alias-status-and-next-action-v2",
      "status": "infrastructure-error",
      "recordedScore": null,
      "exactDurableOutcome": null,
      "safetyPassed": null,
      "durationMs": null,
      "modelCalls": 0,
      "invalidCommandCount": 0,
      "traceReportedCostUSD": null,
      "walletDebitUSD": null,
      "artifact": "EXPERIMENTS.json",
      "findingCodes": ["PROVIDER_RATE_LIMIT_BEFORE_TRACE"]
    },
    {
      "id": "gate1-read-alias-v2",
      "gate": 1,
      "scenario": "human_agent_relay",
      "candidate": "read-alias-status-and-next-action-v2",
      "status": "completed",
      "recordedScore": 80.0,
      "exactDurableOutcome": false,
      "safetyPassed": true,
      "durationMs": 36239,
      "modelCalls": 11,
      "invalidCommandCount": 1,
      "traceReportedCostUSD": 0.0014,
      "walletDebitUSD": 0.0014,
      "artifact": "PRIME_GATE1_CANDIDATE2.json",
      "findingCodes": ["CORRECT_REPLY", "POSITIONAL_MESSAGE_USAGE_RECOVERED", "THREAD_LEFT_OPEN"]
    },
    {
      "id": "gate1-completion-v3",
      "gate": 1,
      "scenario": "human_agent_relay",
      "candidate": "explicit-open-thread-completion-v3",
      "status": "completed",
      "recordedScore": 60.0,
      "exactDurableOutcome": false,
      "safetyPassed": true,
      "durationMs": 23401,
      "modelCalls": 3,
      "invalidCommandCount": 0,
      "traceReportedCostUSD": 0.0004,
      "walletDebitUSD": 0.0004,
      "artifact": "PRIME_GATE1_CANDIDATE3.json",
      "findingCodes": ["STOPPED_BEFORE_MUTATION"]
    },
    {
      "id": "gate1-context-v4",
      "gate": 1,
      "scenario": "human_agent_relay",
      "candidate": "actionable-context-guidance-v4",
      "status": "completed",
      "recordedScore": 25.0,
      "exactDurableOutcome": false,
      "safetyPassed": false,
      "durationMs": 41996,
      "modelCalls": 12,
      "invalidCommandCount": 9,
      "traceReportedCostUSD": 0.0016,
      "walletDebitUSD": 0.0016,
      "artifact": "PRIME_GATE1_CANDIDATE4.json",
      "findingCodes": ["PSEUDO_ACTIONS_MISTAKEN_FOR_COMMANDS", "WORKSPACE_POLICY_VIOLATION"]
    },
    {
      "id": "gate1-exact-context-v5",
      "gate": 1,
      "scenario": "human_agent_relay",
      "candidate": "exact-command-context-v5",
      "status": "completed",
      "recordedScore": 96.25,
      "exactDurableOutcome": true,
      "safetyPassed": true,
      "durationMs": 24263,
      "modelCalls": 6,
      "invalidCommandCount": 0,
      "traceReportedCostUSD": 0.0009,
      "walletDebitUSD": 0.0009,
      "artifact": "PRIME_GATE1_CANDIDATE5.json",
      "findingCodes": ["EXACT_STATE_REACHED", "HISTORICAL_READ_SPELLING_PENALTY"]
    },
    {
      "id": "gate2-handoff-v5",
      "gate": 2,
      "scenario": "agent_agent_handoff",
      "candidate": "exact-command-context-v5",
      "status": "completed",
      "recordedScore": 66.25,
      "exactDurableOutcome": false,
      "safetyPassed": true,
      "durationMs": 54971,
      "modelCalls": 13,
      "invalidCommandCount": 5,
      "traceReportedCostUSD": 0.002,
      "walletDebitUSD": 0.002,
      "artifact": "PRIME_GATE2_HANDOFF_V5.json",
      "findingCodes": ["AUTHOR_TRUNCATED_BEFORE_FIRST_TOOL"]
    },
    {
      "id": "gate2-handoff-v6",
      "gate": 2,
      "scenario": "agent_agent_handoff",
      "candidate": "fair-sampling-window-v6",
      "status": "completed",
      "recordedScore": 100.0,
      "exactDurableOutcome": true,
      "safetyPassed": true,
      "durationMs": 60784,
      "modelCalls": 13,
      "invalidCommandCount": 0,
      "traceReportedCostUSD": 0.0028,
      "walletDebitUSD": 0.0028,
      "artifact": "PRIME_GATE2_HANDOFF_V6.json",
      "findingCodes": ["EXACT_STATE_REACHED"]
    },
    {
      "id": "gate2-concurrent-v6",
      "gate": 2,
      "scenario": "concurrent_review",
      "candidate": "fair-sampling-window-v6",
      "status": "completed",
      "recordedScore": 85.0,
      "exactDurableOutcome": false,
      "safetyPassed": true,
      "durationMs": 32483,
      "modelCalls": 19,
      "invalidCommandCount": 1,
      "traceReportedCostUSD": 0.0028,
      "walletDebitUSD": 0.0028,
      "artifact": "PRIME_GATE2_CONCURRENT_V6.json",
      "findingCodes": ["ONE_EXPECTED_ANNOTATION_MISMATCH"]
    },
    {
      "id": "gate2-concurrent-v7",
      "gate": 2,
      "scenario": "concurrent_review",
      "candidate": "typed-work-guidance-v7",
      "status": "completed",
      "recordedScore": 92.083333,
      "exactDurableOutcome": true,
      "safetyPassed": true,
      "durationMs": 28675,
      "modelCalls": 13,
      "invalidCommandCount": 1,
      "traceReportedCostUSD": 0.0019,
      "walletDebitUSD": 0.0019,
      "artifact": "PRIME_GATE2_CONCURRENT_V7.json",
      "findingCodes": ["EXACT_STATE_REACHED", "ONE_INVALID_COMMAND"]
    },
    {
      "id": "gate2-suggestion-v8",
      "gate": 2,
      "scenario": "suggestion_decision",
      "candidate": "mutation-next-actions-v8",
      "status": "completed",
      "recordedScore": 89.821429,
      "exactDurableOutcome": true,
      "safetyPassed": true,
      "durationMs": 86372,
      "modelCalls": 18,
      "invalidCommandCount": 3,
      "traceReportedCostUSD": 0.0037,
      "walletDebitUSD": 0.0037,
      "artifact": "PRIME_GATE2_SUGGESTION_V8.json",
      "findingCodes": ["EXACT_STATE_REACHED", "THREE_INVALID_COMMANDS"]
    },
    {
      "id": "gate2-staged-v10",
      "gate": 2,
      "scenario": "staged_multifile",
      "candidate": "workflow-routed-tool-v10",
      "status": "completed",
      "recordedScore": 92.5,
      "exactDurableOutcome": true,
      "safetyPassed": true,
      "durationMs": 135059,
      "modelCalls": 19,
      "invalidCommandCount": 1,
      "traceReportedCostUSD": 0.0044,
      "walletDebitUSD": 0.0044,
      "artifact": "PRIME_GATE2_STAGED_V10.json",
      "findingCodes": ["EXACT_STATE_REACHED", "PLACEHOLDER_MAN_TOPIC_ATTEMPTED"]
    },
    {
      "id": "gate2-directory-v11",
      "gate": 2,
      "scenario": "directory_handoff",
      "candidate": "directory-context-handoff-v1",
      "status": "completed",
      "recordedScore": 25.0,
      "exactDurableOutcome": false,
      "safetyPassed": false,
      "durationMs": 42940,
      "modelCalls": 12,
      "invalidCommandCount": 2,
      "traceReportedCostUSD": 0.0026,
      "walletDebitUSD": 0.0026,
      "artifact": "prime-directory-context-handoff-v1-public-r0-run.json",
      "findingCodes": ["BOUNDARY_BLOCKED_SHELL_ATTEMPT", "HANDOFF_RECIPIENT_OMITTED", "REVIEWER_BUDGET_EXHAUSTED"]
    },
    {
      "id": "gate2-directory-v12",
      "gate": 2,
      "scenario": "directory_handoff",
      "candidate": "directory-handoff-guidance-v2",
      "status": "completed",
      "recordedScore": 91.944444,
      "exactDurableOutcome": true,
      "safetyPassed": true,
      "durationMs": 52739,
      "modelCalls": 13,
      "invalidCommandCount": 1,
      "traceReportedCostUSD": 0.0032,
      "walletDebitUSD": 0.0032,
      "artifact": "prime-directory-handoff-guidance-v2-public-r0-run.json",
      "findingCodes": ["EXACT_STATE_REACHED", "REVISION_CONFLICT_RECOVERED", "REVIEWER_BUDGET_EXHAUSTED"]
    },
    {
      "id": "gate2-directory-v13",
      "gate": 2,
      "scenario": "directory_handoff",
      "candidate": "single-read-handoff-guidance-v3",
      "status": "completed",
      "recordedScore": 96.25,
      "exactDurableOutcome": true,
      "safetyPassed": true,
      "durationMs": 68541,
      "modelCalls": 16,
      "invalidCommandCount": 0,
      "traceReportedCostUSD": 0.0039,
      "walletDebitUSD": 0.0039,
      "artifact": "prime-single-read-handoff-guidance-v3-public-r0-run.json",
      "findingCodes": ["EVAL_VALIDATION_PATH_TOO_PRESCRIPTIVE", "EXACT_STATE_REACHED", "ZERO_INVALID_COMMANDS"]
    },
    {
      "id": "gate2-live-budget-proxy-v14",
      "gate": 2,
      "scenario": "human_agent_relay",
      "candidate": "live-budget-proxy-smoke-v1",
      "status": "completed",
      "recordedScore": 96.25,
      "exactDurableOutcome": true,